{
  "schemaVersion": "PHI-OS-IMR-PRODUCTION-ELIGIBILITY-REGISTRY-v1.0.0",
  "stageCode": "IMR-W4",
  "registryCode": "IMR_PRODUCTION_ELIGIBILITY_REGISTRY",
  "registryVersion": "1.0.0",
  "status": "active_governance_registry",
  "baseline": {
    "repository": "getphioscs-UX/phios",
    "branch": "main",
    "commit": "aa3a09aaccb4f7f19f9cc571f4b3c9094504611a"
  },
  "authority": "INTERPRETIVE_METHOD_GOVERNANCE",
  "runtimeAuthority": false,
  "methodRegistryReference": "content/professional/method-governance/imr-method-registry-v1.json",
  "commercialLicenseReference": "content/professional/method-governance/imr-commercial-license-registry-v1.json",
  "algorithmGovernanceReference": "content/professional/method-governance/imr-algorithm-governance-registry-v1.json",
  "professionalRuntimeReference": "content/professional/method-runtime/shared-professional-runtime-v1.json",
  "eligibilityPolicy": {
    "allGatesRequired": true,
    "failClosed": true,
    "registrationCreatesEligibility": false,
    "commercialLicenseRequired": true,
    "validationRequired": true,
    "regressionRequired": true,
    "sharedRuntimeImplementationRequired": true,
    "professionalBoundaryRequired": true,
    "professionalWorkflowRequired": true,
    "eligibilityCreatesReleaseAuthority": false,
    "versionManagementGovernedBy": "IMR-W5",
    "freezeGovernedBy": "IMR-W6"
  },
  "methods": [
    {
      "methodCode": "HUMAN_DESIGN",
      "methodVersion": "1.0.0",
      "eligibilityVersion": "1.0.0",
      "productionReady": false,
      "professionalReady": false,
      "validationPassed": false,
      "regressionPassed": false,
      "commercialLicensePassed": false,
      "sharedRuntimeImplemented": false,
      "professionalBoundaryPassed": false,
      "professionalWorkflowPassed": false,
      "eligibilityStatus": "blocked",
      "blockingReasons": [
        "COMMERCIAL_LICENSE_NOT_APPROVED",
        "ALGORITHM_VALIDATION_NOT_PASSED",
        "REGRESSION_NOT_PASSED",
        "SHARED_RUNTIME_IMPLEMENTATION_NOT_CONFIRMED",
        "PROFESSIONAL_BOUNDARY_ACCEPTANCE_NOT_RECORDED",
        "PROFESSIONAL_WORKFLOW_READINESS_NOT_PASSED"
      ],
      "decisionAuthority": "INTERPRETIVE_METHOD_GOVERNANCE",
      "productionAuthorityCreated": false
    },
    {
      "methodCode": "ASTROLOGY",
      "methodVersion": "0.1.0",
      "eligibilityVersion": "1.0.0",
      "productionReady": false,
      "professionalReady": false,
      "validationPassed": false,
      "regressionPassed": false,
      "commercialLicensePassed": true,
      "sharedRuntimeImplemented": false,
      "professionalBoundaryPassed": false,
      "professionalWorkflowPassed": false,
      "eligibilityStatus": "blocked",
      "blockingReasons": [
        "ALGORITHM_VALIDATION_NOT_PASSED",
        "REGRESSION_NOT_PASSED",
        "SHARED_RUNTIME_IMPLEMENTATION_NOT_CONFIRMED",
        "PROFESSIONAL_BOUNDARY_ACCEPTANCE_NOT_RECORDED",
        "PROFESSIONAL_WORKFLOW_READINESS_NOT_PASSED"
      ],
      "decisionAuthority": "INTERPRETIVE_METHOD_GOVERNANCE",
      "productionAuthorityCreated": false
    },
    {
      "methodCode": "BAZI",
      "methodVersion": "0.1.0",
      "eligibilityVersion": "1.0.0",
      "productionReady": false,
      "professionalReady": false,
      "validationPassed": false,
      "regressionPassed": false,
      "commercialLicensePassed": false,
      "sharedRuntimeImplemented": false,
      "professionalBoundaryPassed": false,
      "professionalWorkflowPassed": false,
      "eligibilityStatus": "blocked",
      "blockingReasons": [
        "COMMERCIAL_LICENSE_NOT_APPROVED",
        "ALGORITHM_VALIDATION_NOT_PASSED",
        "REGRESSION_NOT_PASSED",
        "SHARED_RUNTIME_IMPLEMENTATION_NOT_CONFIRMED",
        "PROFESSIONAL_BOUNDARY_ACCEPTANCE_NOT_RECORDED",
        "PROFESSIONAL_WORKFLOW_READINESS_NOT_PASSED"
      ],
      "decisionAuthority": "INTERPRETIVE_METHOD_GOVERNANCE",
      "productionAuthorityCreated": false
    },
    {
      "methodCode": "I_CHING",
      "methodVersion": "0.1.0",
      "eligibilityVersion": "1.0.0",
      "productionReady": false,
      "professionalReady": false,
      "validationPassed": false,
      "regressionPassed": false,
      "commercialLicensePassed": false,
      "sharedRuntimeImplemented": false,
      "professionalBoundaryPassed": false,
      "professionalWorkflowPassed": false,
      "eligibilityStatus": "blocked",
      "blockingReasons": [
        "COMMERCIAL_LICENSE_NOT_APPROVED",
        "ALGORITHM_VALIDATION_NOT_PASSED",
        "REGRESSION_NOT_PASSED",
        "SHARED_RUNTIME_IMPLEMENTATION_NOT_CONFIRMED",
        "PROFESSIONAL_BOUNDARY_ACCEPTANCE_NOT_RECORDED",
        "PROFESSIONAL_WORKFLOW_READINESS_NOT_PASSED"
      ],
      "decisionAuthority": "INTERPRETIVE_METHOD_GOVERNANCE",
      "productionAuthorityCreated": false
    },
    {
      "methodCode": "TAROT",
      "methodVersion": "0.1.0",
      "eligibilityVersion": "1.0.0",
      "productionReady": false,
      "professionalReady": false,
      "validationPassed": false,
      "regressionPassed": false,
      "commercialLicensePassed": false,
      "sharedRuntimeImplemented": false,
      "professionalBoundaryPassed": false,
      "professionalWorkflowPassed": false,
      "eligibilityStatus": "blocked",
      "blockingReasons": [
        "COMMERCIAL_LICENSE_NOT_APPROVED",
        "ALGORITHM_VALIDATION_NOT_PASSED",
        "REGRESSION_NOT_PASSED",
        "SHARED_RUNTIME_IMPLEMENTATION_NOT_CONFIRMED",
        "PROFESSIONAL_BOUNDARY_ACCEPTANCE_NOT_RECORDED",
        "PROFESSIONAL_WORKFLOW_READINESS_NOT_PASSED"
      ],
      "decisionAuthority": "INTERPRETIVE_METHOD_GOVERNANCE",
      "productionAuthorityCreated": false
    },
    {
      "methodCode": "PSYCHOLOGY",
      "methodVersion": "0.1.0",
      "eligibilityVersion": "1.0.0",
      "productionReady": false,
      "professionalReady": false,
      "validationPassed": false,
      "regressionPassed": false,
      "commercialLicensePassed": false,
      "sharedRuntimeImplemented": false,
      "professionalBoundaryPassed": false,
      "professionalWorkflowPassed": false,
      "eligibilityStatus": "blocked",
      "blockingReasons": [
        "COMMERCIAL_LICENSE_NOT_APPROVED",
        "ALGORITHM_VALIDATION_NOT_PASSED",
        "REGRESSION_NOT_PASSED",
        "SHARED_RUNTIME_IMPLEMENTATION_NOT_CONFIRMED",
        "PROFESSIONAL_BOUNDARY_ACCEPTANCE_NOT_RECORDED",
        "PROFESSIONAL_WORKFLOW_READINESS_NOT_PASSED"
      ],
      "decisionAuthority": "INTERPRETIVE_METHOD_GOVERNANCE",
      "productionAuthorityCreated": false
    }
  ]
}
